{
  "schemaVersion": "1.0.0",
  "kind": "resource-version",
  "id": "5d19af39-1bd7-49e9-bd59-d0aa80f6976b",
  "resourceId": "b84d295d-8ccb-4676-91ea-c6bbc7a905df",
  "label": "b36e0829c6d0",
  "ref": {
    "type": "commit",
    "value": "main",
    "commitSha": "b36e0829c6d0140e93cfef2ca599b1b07d4a7797"
  },
  "monitoredPathSha256": "e3b0c44298fc1c149afbf4c8996fb92427ae41e4649b934ca495991b7852b855",
  "upstreamPublishedAt": "2026-08-19T07:29:52.997Z",
  "approvedAt": "2026-08-19T07:29:52.997Z",
  "officialDownloadUrl": "https://raw.githubusercontent.com/obra/superpowers/b36e0829c6d0140e93cfef2ca599b1b07d4a7797/skills/brainstorming/SKILL.md",
  "packaging": {
    "mode": "registry-zip",
    "packagedAt": "2026-08-19T07:29:52.996Z",
    "artifactFileName": "obra-superpowers-brainstorming-b36e0829c6d0.zip",
    "artifactSha256": "ec0e7c0f89a4c2d36500044e3fd75e57f0db2180a1bc4a1a617e44fc473c3bc0",
    "payloadSha256": "ac98ed8175e39334d4d16c67c350b563595abf9fd9efe2e2f5796a4b050e4246",
    "sizeBytes": 7381,
    "githubReleaseTag": "resource/obra-superpowers-brainstorming/b36e0829c6d0"
  }
}
