{
  "schemaVersion": "1.0.0",
  "kind": "resource-version",
  "id": "11111111-1111-4111-8111-111111111122",
  "resourceId": "11111111-1111-4111-8111-111111111114",
  "label": "1.2.3",
  "ref": { "type": "release", "value": "v1.2.3", "commitSha": "6acc160e4e0cd062dbbbd7a1b26ae92855edf07e" },
  "monitoredPathSha256": "6d0c0daa25b9233183736613a5eb6b22dfa3954c79b4f344f37b54e6b8481bc4",
  "upstreamPublishedAt": "2026-08-06T14:05:28Z",
  "approvedAt": "2026-08-19T00:00:00Z",
  "officialDownloadUrl": "https://github.com/mattpocock/skills/releases/tag/v1.2.3",
  "packaging": { "mode": "link-only", "packagedAt": "2026-08-19T00:00:00Z", "artifactFileName": null, "artifactSha256": null, "payloadSha256": null, "sizeBytes": null, "githubReleaseTag": null }
}
