{
  "schemaVersion": "1.0.0",
  "kind": "resource-version",
  "id": "4b1d4f28-a0e0-48b6-a234-087c3570ab4d",
  "resourceId": "b8f78c66-db8a-4016-9a4d-76dd8101f4b2",
  "label": "b36e0829c6d0",
  "ref": {
    "type": "commit",
    "value": "main",
    "commitSha": "b36e0829c6d0140e93cfef2ca599b1b07d4a7797"
  },
  "monitoredPathSha256": "e3b0c44298fc1c149afbf4c8996fb92427ae41e4649b934ca495991b7852b855",
  "upstreamPublishedAt": "2026-08-19T07:29:45.794Z",
  "approvedAt": "2026-08-19T07:29:45.794Z",
  "officialDownloadUrl": "https://raw.githubusercontent.com/obra/superpowers/b36e0829c6d0140e93cfef2ca599b1b07d4a7797/.claude-plugin/plugin.json",
  "packaging": {
    "mode": "registry-zip",
    "packagedAt": "2026-08-19T07:29:45.794Z",
    "artifactFileName": "obra-superpowers-claude-plugin-b36e0829c6d0.zip",
    "artifactSha256": "52b8c7ea26cf4c9bdd1b0bc198de9416e56c0d4972f966ab0527cf60c4eb4cc5",
    "payloadSha256": "40d3cfc3278058057c7e8ea5e1e00fe5b737633352f351cdbb6ed6c94256105a",
    "sizeBytes": 1676,
    "githubReleaseTag": "resource/obra-superpowers-claude-plugin/b36e0829c6d0"
  }
}
