{
  "schemaVersion": "1.0.0",
  "kind": "resource-version",
  "id": "33333333-3333-4333-8333-333333333337",
  "resourceId": "33333333-3333-4333-8333-333333333335",
  "label": "6.3.0",
  "ref": { "type": "release", "value": "v6.3.0", "commitSha": "b36e0829c6d0140e93cfef2ca599b1b07d4a7797" },
  "monitoredPathSha256": "0cc611204476e5a406ea3d0a6297c00f3f8350aef1233b4d0a45f861b26b11c9",
  "upstreamPublishedAt": "2026-08-12T16:58:30Z",
  "approvedAt": "2026-08-19T00:00:00Z",
  "officialDownloadUrl": "https://github.com/obra/superpowers/releases/tag/v6.3.0",
  "packaging": { "mode": "link-only", "packagedAt": "2026-08-19T00:00:00Z", "artifactFileName": null, "artifactSha256": null, "payloadSha256": null, "sizeBytes": null, "githubReleaseTag": null }
}
