{
  "schemaVersion": "1.0.0",
  "kind": "resource-version",
  "id": "11111111-1111-4111-8111-111111111121",
  "resourceId": "11111111-1111-4111-8111-111111111113",
  "label": "1.2.3",
  "ref": { "type": "release", "value": "v1.2.3", "commitSha": "6acc160e4e0cd062dbbbd7a1b26ae92855edf07e" },
  "monitoredPathSha256": "0c28d1743adfb8f692e34c2a77a54ff4dfd7e011afdb12f8921e9a4c3081be7f",
  "upstreamPublishedAt": "2026-08-06T14:05:28Z",
  "approvedAt": "2026-08-19T00:00:00Z",
  "officialDownloadUrl": "https://github.com/mattpocock/skills/releases/tag/v1.2.3",
  "packaging": { "mode": "registry-zip", "packagedAt": "2026-08-19T00:00:00Z", "artifactFileName": "mattpocock-skills-1.2.3.zip", "artifactSha256": "2cf688bcad2f998570b289f5b3f90575ec5653991eaedf6cf5efeb361b8387a3", "payloadSha256": "a844b21cd9c3238ba43444894bdb1a47a175d83cf0c95b9b4564be46117664cc", "sizeBytes": 109802, "githubReleaseTag": "resource/mattpocock-skills/1.2.3" }
}
