{
  "schemaVersion": "1.0.0",
  "kind": "resource-version",
  "id": "22222222-2222-4222-8222-222222222227",
  "resourceId": "22222222-2222-4222-8222-222222222224",
  "label": "4.0.2",
  "ref": { "type": "release", "value": "@upstash/context7-mcp@4.0.2", "commitSha": "5284672feb575908efead6fcf1b5e542f8d607bb" },
  "monitoredPathSha256": "4ecb5a4370b26e297fa863db483508f94e18064c04e074e938fb6530a6ef4939",
  "upstreamPublishedAt": "2026-08-11T16:30:20Z",
  "approvedAt": "2026-08-19T00:00:00Z",
  "officialDownloadUrl": "https://github.com/upstash/context7/releases/tag/%40upstash%2Fcontext7-mcp%404.0.2",
  "packaging": { "mode": "registry-zip", "packagedAt": "2026-08-19T00:00:00Z", "artifactFileName": "context7-mcp-4.0.2.zip", "artifactSha256": "4bd6276153bf9de9395695b7e5b322eceb83c5a47ec95bb60b2f2a75b8209562", "payloadSha256": "ccf8579ad6d5faeca7ab42b1f2bc271ad4d5f92f1abe3a0996c9903bd5e1c24c", "sizeBytes": 73411, "githubReleaseTag": "resource/context7-mcp/4.0.2" }
}
