{
  "schemaVersion": "1.0.0",
  "kind": "resource-version",
  "id": "0fa50ab9-c678-4bbc-998c-1c9dcd412641",
  "resourceId": "1bffd192-5d11-4a3f-9b93-b5ab7b0693e4",
  "label": "b36e0829c6d0",
  "ref": {
    "type": "commit",
    "value": "main",
    "commitSha": "b36e0829c6d0140e93cfef2ca599b1b07d4a7797"
  },
  "monitoredPathSha256": "e3b0c44298fc1c149afbf4c8996fb92427ae41e4649b934ca495991b7852b855",
  "upstreamPublishedAt": "2026-08-19T07:29:48.439Z",
  "approvedAt": "2026-08-19T07:29:48.439Z",
  "officialDownloadUrl": "https://raw.githubusercontent.com/obra/superpowers/b36e0829c6d0140e93cfef2ca599b1b07d4a7797/.agents/plugins/marketplace.json",
  "packaging": {
    "mode": "registry-zip",
    "packagedAt": "2026-08-19T07:29:48.439Z",
    "artifactFileName": "obra-superpowers-plugins-b36e0829c6d0.zip",
    "artifactSha256": "fe702bc5db13ad5ff4178e804c06d3921f5200c65b77c842d1f62af6a40f45ee",
    "payloadSha256": "815acf22f4f66d2d84d04cb41cfa3f8896259b14a27ccdb9a1f6c668c55eb599",
    "sizeBytes": 1610,
    "githubReleaseTag": "resource/obra-superpowers-plugins/b36e0829c6d0"
  }
}
