{
  "schemaVersion": "1.0.0",
  "kind": "resource-version",
  "id": "ab371958-b83d-4f4f-81b2-5109053d44fa",
  "resourceId": "bc2bfa90-cd89-4b2b-b789-361de1fd3c59",
  "label": "b36e0829c6d0",
  "ref": {
    "type": "commit",
    "value": "main",
    "commitSha": "b36e0829c6d0140e93cfef2ca599b1b07d4a7797"
  },
  "monitoredPathSha256": "e3b0c44298fc1c149afbf4c8996fb92427ae41e4649b934ca495991b7852b855",
  "upstreamPublishedAt": "2026-08-19T07:29:14.352Z",
  "approvedAt": "2026-08-19T07:29:14.352Z",
  "officialDownloadUrl": "https://raw.githubusercontent.com/obra/superpowers/b36e0829c6d0140e93cfef2ca599b1b07d4a7797/skills/writing-plans/SKILL.md",
  "packaging": {
    "mode": "registry-zip",
    "packagedAt": "2026-08-19T07:29:14.352Z",
    "artifactFileName": "obra-superpowers-writing-plans-b36e0829c6d0.zip",
    "artifactSha256": "70f58d4251f06708c76916a1432ed9312875ccab8cf1e965b92c303f4e62ffd3",
    "payloadSha256": "fd20ca7e1aac11ee1ab0fb9c8fc58a375cf666b4d227e6f5df554f8495aea7f3",
    "sizeBytes": 4666,
    "githubReleaseTag": "resource/obra-superpowers-writing-plans/b36e0829c6d0"
  }
}
