{
  "schemaVersion": "1.0.0",
  "kind": "resource-version",
  "id": "58f9767f-248a-47af-8ca1-f7d5ab7ef940",
  "resourceId": "71134d0a-5dca-47dd-9b3f-c5096bf5574a",
  "label": "b36e0829c6d0",
  "ref": {
    "type": "commit",
    "value": "main",
    "commitSha": "b36e0829c6d0140e93cfef2ca599b1b07d4a7797"
  },
  "monitoredPathSha256": "e3b0c44298fc1c149afbf4c8996fb92427ae41e4649b934ca495991b7852b855",
  "upstreamPublishedAt": "2026-08-19T07:29:36.256Z",
  "approvedAt": "2026-08-19T07:29:36.256Z",
  "officialDownloadUrl": "https://raw.githubusercontent.com/obra/superpowers/b36e0829c6d0140e93cfef2ca599b1b07d4a7797/skills/finishing-a-development-branch/SKILL.md",
  "packaging": {
    "mode": "registry-zip",
    "packagedAt": "2026-08-19T07:29:36.256Z",
    "artifactFileName": "obra-superpowers-finishing-a-development-branch-b36e0829c6d0.zip",
    "artifactSha256": "96e8584b7c9ff6f13c4f1010e89b1b4e638fab6555c503f5529f2d0412e2295d",
    "payloadSha256": "a6efadd74fa78b7e532950e0894e29d4574ad474a1a82c270156bf77e8154b1a",
    "sizeBytes": 4680,
    "githubReleaseTag": "resource/obra-superpowers-finishing-a-development-branch/b36e0829c6d0"
  }
}
